{
  "version": {
    "major": 0,
    "minor": 0
  },
  "family": "publish-source-snapshot",
  "requestId": "req-1",
  "kind": "notification",
  "payload": {
    "context": {
      "workspaceId": "workspace-a",
      "projectId": "app",
      "compilationContextId": "ctx-3",
      "snapshot": {
        "hostId": "host-a",
        "documentUri": "workspace://sample/Counter.cs",
        "hostVersion": "v8",
        "snapshotId": "s8"
      }
    },
    "mode": "complete",
    "provenance": "host-buffer",
    "encoding": "utf-8",
    "text": "int Count() => 12;"
  },
  "extensions": {}
}
