{
  "version": {
    "major": 0,
    "minor": 0
  },
  "family": "publish-source-snapshot",
  "requestId": "req-1",
  "kind": "notification",
  "payload": {
    "context": {
      "workspaceId": "workspace-a",
      "projectId": "app",
      "compilationContextId": "ctx-3",
      "snapshot": {
        "hostId": "host-a",
        "documentUri": "workspace://sample/Counter.cs",
        "hostVersion": "v8",
        "snapshotId": "s8"
      }
    },
    "mode": "incremental",
    "provenance": "host-buffer",
    "baseSnapshotId": "s7",
    "changes": [
      {
        "span": {
          "snapshot": {
            "hostId": "host-a",
            "documentUri": "workspace://sample/Counter.cs",
            "hostVersion": "v7",
            "snapshotId": "s7"
          },
          "coordinates": "utf16-offset",
          "start": 0,
          "length": 17
        },
        "text": "return 12;"
      }
    ]
  },
  "extensions": {}
}
